{
  "schema_version": "1.0.0",
  "runtime_scenario_report_id": "runtime_scenario_report_ws_productos_v2_adapter_parity",
  "workspace_id": "ws_productos_v2",
  "baseline_version": "4.4.0",
  "candidate_version": "4.5.0",
  "status": "passed",
  "summary": "The adapter hardening slice proves the same bounded repo contract across Codex, Claude-style, Windsurf, and Antigravity without changing ProductOS logic.",
  "scenarios": [
    {
      "scenario_id": "scenario_claude_style_repo_contract_parity",
      "name": "Claude-style repo-contract parity",
      "status": "passed",
      "metric_deltas": [
        {
          "metric_name": "repo_contract_deviation_count",
          "baseline_value": 1,
          "candidate_value": 0,
          "unit": "count",
          "trend": "improved"
        }
      ],
      "evidence_refs": [
        "runtime_adapter_registry_ws_productos_v2_next_version",
        "core/docs/thin-agent-adapter-model.md"
      ],
      "gaps": []
    },
    {
      "scenario_id": "scenario_windsurf_repo_contract_parity",
      "name": "Windsurf repo-contract parity",
      "status": "passed",
      "metric_deltas": [
        {
          "metric_name": "repo_contract_deviation_count",
          "baseline_value": 1,
          "candidate_value": 0,
          "unit": "count",
          "trend": "improved"
        }
      ],
      "evidence_refs": [
        "runtime_adapter_registry_ws_productos_v2_next_version",
        "core/docs/thin-agent-adapter-model.md"
      ],
      "gaps": []
    },
    {
      "scenario_id": "scenario_antigravity_repo_contract_parity",
      "name": "Antigravity repo-contract parity",
      "status": "passed",
      "metric_deltas": [
        {
          "metric_name": "repo_contract_deviation_count",
          "baseline_value": 1,
          "candidate_value": 0,
          "unit": "count",
          "trend": "improved"
        }
      ],
      "evidence_refs": [
        "runtime_adapter_registry_ws_productos_v2_next_version",
        "core/docs/thin-agent-adapter-model.md"
      ],
      "gaps": []
    }
  ],
  "generated_at": "2026-03-22T08:00:00Z"
}
