{
  "schema_version": "1.0.0",
  "runtime_scenario_report_id": "runtime_scenario_report_ws_productos_v2_runtime",
  "workspace_id": "ws_productos_v2",
  "baseline_version": "2.0.0",
  "candidate_version": "3.0.0",
  "status": "passed",
  "summary": "The V3 runtime materially improves coordination visibility, intake routing, and memory reuse over V2, and all release-gate scenarios passed.",
  "scenarios": [
    {
      "scenario_id": "scenario_live_coordination_visibility",
      "name": "Live coordination visibility",
      "status": "passed",
      "metric_deltas": [
        {
          "metric_name": "time_to_identify_blocked_route_minutes",
          "baseline_value": 12,
          "candidate_value": 2,
          "unit": "minutes",
          "trend": "improved"
        }
      ],
      "evidence_refs": [
        "cockpit_state_ws_productos_v2_runtime",
        "orch_state_ws_productos_v2_runtime"
      ],
      "gaps": []
    },
    {
      "scenario_id": "scenario_continuous_intake_routing",
      "name": "Continuous intake to downstream routing",
      "status": "passed",
      "metric_deltas": [
        {
          "metric_name": "time_to_route_new_inbox_item_minutes",
          "baseline_value": 18,
          "candidate_value": 4,
          "unit": "minutes",
          "trend": "improved"
        }
      ],
      "evidence_refs": [
        "intake_routing_state_ws_productos_v2_runtime"
      ],
      "gaps": []
    },
    {
      "scenario_id": "scenario_memory_retrieval_with_provenance",
      "name": "Memory retrieval with provenance visibility",
      "status": "passed",
      "metric_deltas": [
        {
          "metric_name": "time_to_find_relevant_prior_context_minutes",
          "baseline_value": 25,
          "candidate_value": 8,
          "unit": "minutes",
          "trend": "improved"
        },
        {
          "metric_name": "unsupported_memory_claim_risk_count",
          "baseline_value": 2,
          "candidate_value": 0,
          "unit": "count",
          "trend": "improved"
        }
      ],
      "evidence_refs": [
        "memory_retrieval_state_ws_productos_v2_runtime",
        "feedback_cluster_state_ws_productos_v2_runtime"
      ],
      "gaps": []
    }
  ],
  "generated_at": "2026-03-21T23:30:00Z"
}
