{
  "schema_version": "1.0.0",
  "runtime_scenario_report_id": "runtime_scenario_report_ws_productos_v2_market_refresh",
  "workspace_id": "ws_productos_v2",
  "baseline_version": "4.4.0",
  "candidate_version": "4.5.0",
  "status": "passed",
  "summary": "The market-refresh hardening slice proves unattended-refresh freshness, contradiction, and escalation guardrails as a reusable foundation for broader distribution.",
  "scenarios": [
    {
      "scenario_id": "scenario_market_refresh_freshness_guardrail",
      "name": "Unattended refresh freshness guardrail",
      "status": "passed",
      "metric_deltas": [
        {
          "metric_name": "stale_source_escape_count",
          "baseline_value": 2,
          "candidate_value": 0,
          "unit": "count",
          "trend": "improved"
        }
      ],
      "evidence_refs": [
        "research_feature_recommendation_brief_ws_productos_v2_v4_1",
        "validation_lane_report_ws_productos_v2_market_intelligence"
      ],
      "gaps": []
    },
    {
      "scenario_id": "scenario_market_refresh_contradiction_escalation",
      "name": "Unattended refresh contradiction escalation",
      "status": "passed",
      "metric_deltas": [
        {
          "metric_name": "unresolved_contradiction_release_risk_count",
          "baseline_value": 1,
          "candidate_value": 0,
          "unit": "count",
          "trend": "improved"
        }
      ],
      "evidence_refs": [
        "rejected_path_record_ws_productos_v2_market_intelligence_gap",
        "core/docs/v4-1-agentic-market-intelligence.md"
      ],
      "gaps": []
    },
    {
      "scenario_id": "scenario_market_refresh_reviewable_digest",
      "name": "Recurring refresh to reviewable digest",
      "status": "passed",
      "metric_deltas": [
        {
          "metric_name": "time_to_review_refresh_digest_minutes",
          "baseline_value": 45,
          "candidate_value": 10,
          "unit": "minutes",
          "trend": "improved"
        }
      ],
      "evidence_refs": [
        "workspaces/productos-v2/docs/research/market-intelligence-review.md",
        "workspaces/productos-v2/docs/research/research-feature-recommendations.md"
      ],
      "gaps": []
    }
  ],
  "generated_at": "2026-03-22T17:12:00Z"
}
